### ISSUE TITLE
D1 pgctl - /etc/init.d/cagentd stop で cagentd が停止しない場合がある

### ISSUE THREAD

**Issue by tora** [suzumura-ss/castoro#80]
整理番号 D1 の pgctl 側

バージョン: castoro-pgctl-0.0.3.gem
CentOS 6.2 64ビット で多発

**Comment by tora** [comment]
cagentd の内部動作をトレースするために、RubyTracer エクステンションを開発しました。
https://github.com/ToshiyukiTerashita/castoro/tree/sandbox/sandbox/ruby_tracer

本エクステンションを使用すると、どの Ruby スクリプトファイルのどの行を実行したかがログファイルに記録されます。

ログファイルの内容は、経過時刻、プロセスID、スレッドID、種別、ソースファイル名、行番号 です。

さらに、append_source_code.rb を使って、ソースファイル名の行番号の内容を各行の行末に追加します。

**Comment by tora** [comment]
cagentd を RubyTracer 付きで起動し、さらに /etc/init.d/cagentd stop したときの cagentd デーモンのログを取得しました。

解析しましたところ、
https://github.com/ToshiyukiTerashita/castoro/blob/sandbox/sandbox/ruby_tracer/tracer.log.source.code.appended.sample.txt#L3178
で、
return [ nil, nil ] となっていることが判明いたしました。

期待としては、/etc/init.d/cagentd から送られてきたはずの文字列 ["1.1","C","SHUTDOWN",null] の解釈結果として、
return [ "SHUTDOWN", nil ] となっているはずなんですが、どこかに不具合があるようです。

/etc/init.d/cagentd が送っているはずの文字列
https://github.com/ToshiyukiTerashita/castoro/blob/f8633c2a339c39fa3d1cd400058ef5dbdf97fc03/castoro-pgctl/etc/init.d/cagentd#L48

**Comment by tora** [comment]
/etc/init.d/cagentd stop が cagentd デーモンプロセスへ送信する通信データを tcpdump コマンドで取得してみました。

<pre>
# tcpdump -i lo -w tcpdump.log port 30151 &
</pre>


<pre>
# /etc/init.d/cagentd stop
...
</pre>


<pre>
# kill %1
17 packets captured
34 packets received by filter
0 packets dropped by kernel
</pre>


<pre>
# tcpdump -r tcpdump.log -X
...
12:46:04.448911 IP6 localhost.51184 > localhost.30151: Flags [S], seq 4053141941, win 32752, options [mss 16376,sackOK,TS val 2060088591 ecr 0,nop,wscale 6], length 0
12:46:04.448911 IP6 localhost.30151 > localhost.51184: Flags [R.], seq 0, ack 4053141942, win 0, length 0
↑ IPv6 で接続しようと試み、RST で拒否されています。

12:46:04.448911 IP localhost.46014 > localhost.30151: Flags [S], seq 814692828, win 32792, options [mss 16396,sackOK,TS val 2060088591 ecr 0,nop,wscale 6], length 0
12:46:04.448911 IP localhost.30151 > localhost.46014: Flags [S.], seq 1062726701, ack 814692829, win 32768, options [mss 16396,sackOK,TS val 2060088591 ecr 2060088591,nop,wscale 6], length 0
12:46:04.448911 IP localhost.46014 > localhost.30151: Flags [.], ack 1, win 513, options [nop,nop,TS val 2060088591 ecr 2060088591], length 0
↑ IPv4 で接続を試み、SYN, SYN ACK, ACK の3ウェイハンドシェイクにて接続確立しました。

12:46:04.448911 IP localhost.46014 > localhost.30151: Flags [P.], seq 1:28, ack 1, win 513, options [nop,nop,TS val 2060088591 ecr 2060088591], length 27
    0x0030:            5b22 312e 3122 2c22 4322 2c22      ["1.1","C","
    0x0040:  5348 5554 444f 574e 222c 6e75 6c6c 5d    SHUTDOWN",null]
↑["1.1","C","SHUTDOWN",null] を送っています。

12:46:04.448911 IP localhost.30151 > localhost.46014: Flags [.], ack 28, win 512, options [nop,nop,TS val 2060088591 ecr 2060088591], length 0
↑ ACK が返ってきました。

12:46:04.448911 IP localhost.46014 > localhost.30151: Flags [P.], seq 28:29, ack 1, win 513, options [nop,nop,TS val 2060088591 ecr 2060088591], length 1
    0x0030:            0a                                 .
↑ "\n" を送っています。

12:46:04.448911 IP localhost.30151 > localhost.46014: Flags [.], ack 29, win 512, options [nop,nop,TS val 2060088591 ecr 2060088591], length 0
↑ ACK が返ってきました。
...
</pre>


本来であれば、["1.1","C","SHUTDOWN",null]\n として、一回のパケットで送られるはずのところを、
["1.1","C","SHUTDOWN",null] と
\n とに分断され、二つのパケットで送られていることが判明しました。

**Comment by tora** [comment]
再び、/etc/init.d/cagentd stop の当該行を調べてみますと、
https://github.com/ToshiyukiTerashita/castoro/blob/f8633c2a339c39fa3d1cd400058ef5dbdf97fc03/castoro-pgctl/etc/init.d/cagentd#L48

<pre>
  s=TCPSocket.new 'localhost', $port; \
  s.puts '[\"1.1\",\"C\",\"SHUTDOWN\",null]'; \
  x=s.gets; \
</pre>


↑Socket.puts が使われています。
これでは、Ruby 1.9.x の実装上、問題となります。

Ruby 1.9.x の IO.puts "文字列" の実装では、
まず、 "文字列" を出力します。
さらに、「その文字列長がゼロ」もしくは「その文字列の最後の文字が\nでない」場合には、"\n" を出力します。

http://svn.ruby-lang.org/cgi-bin/viewvc.cgi/tags/v1_9_2_290/io.c?view=markup

<pre>
6133    rb_io_puts(int argc, VALUE *argv, VALUE out)
...
6155            rb_io_write(out, line);
6156            if (RSTRING_LEN(line) == 0 ||
6157                !str_end_with_asciichar(line, '\n')) {
6158                rb_io_write(out, rb_default_rs);
</pre>


このような実装となっているため、tcpdump で見られましたように、二つのパケットに分断されて送られてしまったとわかりました。

この puts 実装の問題点については、Castoro 開発当初に調査・判明しておりました。
そこで、TCPなどの通信部分には puts 使用禁止令を設けておりました。
しかしながら、/etc/init.d/cagentd stop の実装作業におきまして、使用しておりました。

**Comment by tora** [comment]
https://github.com/ToshiyukiTerashita/castoro/blob/f8633c2a339c39fa3d1cd400058ef5dbdf97fc03/castoro-pgctl/lib/castoro-pgctl/tcp_socket.rb#L122

def timed_gets timedout

に、改行文字が含まれていないバケットを受信すると、「データ無し」と誤って解釈してしまうバグがあることが判明いたしました。

**Comment by tora** [comment]
上述の解析結果より、以下の二つの事象が重なり、今回の不具合として健在化してしまった、と結論づけできまそうです。

(1) /etc/init.d/cagentd stop 側で puts を使用してしまったため、["1.1","C","SHUTDOWN",null] と 改行文字とが、別々のパケットで送られてしまった。

(2) cagentd デーモンプロセス側の def timed_gets timedout にバグがあり、改行文字が行末に無い ["1.1","C","SHUTDOWN",null] を受信したため、「データ無し」と誤って解釈してしまった。

**Comment by tora** [comment]
対処案

(1) /etc/init.d/cagentd stop 側では、 puts の代わりに syswrite を使用し、["1.1","C","SHUTDOWN",null]と改行文字とを、一つのパケットで送信するように修正する。

(2) cagentd デーモンプロセス側の def timed_gets timedout のバグを修正し、たとえ改行文字が行末に無い ["1.1","C","SHUTDOWN",null] が送られてきてしまっても、後続の改行文字も受信し正しく解釈するように修正する。

**Comment by tora** [comment]
本バグ対処済み castoro-pgctl-0.3.1.gem をリリースしました。
SHA: ed37640fbd892e6302bd075e4adba123b2e21001
